{
  "request_id": "req-del-cancel-001-ghi789",
  "agreement_no": "AGR-20260601-8800100123456",
  "principal_id": "did:act:example.com/user-alice",
  "cancel_reason": "USER_INITIATED",
  "cancel_remark": "User initiated agreement cancellation",
  "notify_url": "https://agent.example.com/callback/cancel/notify",
  "timestamp": "2026-07-01T14:00:00Z",
  "signature": "MEUCIQDKxJ7dBJz...truncated...Y2jmQg==",
  "signature_algorithm": "ES256"
}
